timestamp,originator,action,network,target,context
2012-06-07T01:46:50-07:00,Ted,ADD,L,Barbara Hines,id, libero. Donec consectetuer mauris id sapien. Cras dolor dolor,
2012-01-22T03:30:31-08:00,Ted,REMOVE,L,Patience Warner,ac libero nec ligula consectetuer rhoncus. Nullam velit dui, semper
2012-11-14T05:44:09-08:00,Ted,REMOVE,F,Ursula Newton,pellentesque, tellus sem mollis dui, in sodales elit erat vitae
2012-07-02T07:17:57-07:00,Ted,ADD,F,Micah Dodson,adipiscing lobortis risus. In mi pede, nonummy ut, molestie in,
2012-08-28T03:10:06-07:00,Ted,ADD,F,Odette Wilkinson,arcu. Sed eu nibh vulputate mauris sagittis placerat. Cras dictum
2012-12-20T03:48:33-08:00,Ted,REMOVE,F,Norman Massey,netus et malesuada fames ac turpis egestas. Aliquam fringilla cursus
2012-09-06T10:02:39-07:00,Ted,REMOVE,F,Briar Noble,ornare tortor at risus. Nunc ac sem ut dolor dapibus
2012-09-23T02:17:36-07:00,Ellen,ADD,G,Walker Reyes,in molestie tortor nibh sit amet orci. Ut sagittis lobortis
2012-12-24T16:59:27-08:00,Ellen,ADD,G,Kevin Bowman,aliquet magna a neque. Nullam ut nisi a odio semper
2012-02-23T03:38:12-08:00,Ellen,REMOVE,G,Slade Melton,turpis vitae purus gravida sagittis. Duis gravida. Praesent eu nulla
2012-01-22T09:38:05-08:00,Ellen,REMOVE,G,Wade Parker,et, rutrum non, hendrerit id, ante. Nunc mauris sapien, cursus
2012-06-24T15:01:20-07:00,Ellen,ADD,G,Latifah Horton,mus. Proin vel nisl. Quisque fringilla euismod enim. Etiam gravida
2012-12-13T19:36:43-08:00,Ellen,ADD,I,Tyrone Guy,felis. Nulla tempor augue ac ipsum. Phasellus vitae mauris sit
2012-07-07T21:01:52-07:00,Ellen,REMOVE,I,Noble Barron,nunc risus varius orci, in consequat enim diam vel arcu.
2013-02-04T23:04:14-08:00,Ellen,REMOVE,I,Trevor Richard,faucibus lectus, a sollicitudin orci sem eget massa. Suspendisse eleifend.
2012-10-09T04:40:26-07:00,Ellen,ADD,I,Ishmael Joseph,Duis risus odio, auctor vitae, aliquet nec, imperdiet nec, leo.
2012-10-19T09:40:45-07:00,Ellen,ADD,I,Emma Mcmahon,et magnis dis parturient montes, nascetur ridiculus mus. Aenean eget
2012-08-30T13:00:17-07:00,John,REMOVE,T,Connor Macdonald,sollicitudin orci sem eget massa. Suspendisse eleifend. Cras sed leo.
2012-08-08T11:58:00-07:00,John,REMOVE,T,Neil Branch,nec luctus felis purus ac tellus. Suspendisse sed dolor. Fusce
2012-12-02T20:13:34-08:00,John,ADD,T,Quincy West,eget odio. Aliquam vulputate ullamcorper magna. Sed eu eros. Nam
2013-04-03T06:23:58-07:00,John,ADD,T,Urielle Townsend,mauris a nunc. In at pede. Cras vulputate velit eu
2012-06-05T02:36:45-07:00,John,REMOVE,T,Justine Jordan,taciti sociosqu ad litora torquent per conubia nostra, per inceptos
2012-02-09T19:20:16-08:00,John,REMOVE,L,Alice Hatfield,libero. Donec consectetuer mauris id sapien. Cras dolor dolor, tempus
2012-09-20T20:00:51-07:00,John,ADD,L,Cooper Bruce,Curabitur vel lectus. Cum sociis natoque penatibus et magnis dis
2012-01-26T21:56:04-08:00,John,ADD,L,May Atkins,vel est tempor bibendum. Donec felis orci, adipiscing non, luctus
2012-10-01T08:31:18-07:00,John,REMOVE,L,Ariel Jackson,dolor dapibus gravida. Aliquam tincidunt, nunc ac mattis ornare, lectus
2012-10-16T19:08:06-07:00,John,REMOVE,L,Amanda Richardson,arcu. Sed eu nibh vulputate mauris sagittis placerat. Cras dictum
2012-02-13T02:53:26-08:00,Steve,ADD,F,Nash Woods,enim non nisi. Aenean eget metus. In nec orci. Donec
2013-03-02T01:34:41-08:00,Steve,ADD,F,Bernard Olsen,dictum eu, eleifend nec, malesuada ut, sem. Nulla interdum. Curabitur
2012-08-22T17:42:27-07:00,Steve,REMOVE,F,Lila Hubbard,id, mollis nec, cursus a, enim. Suspendisse aliquet, sem ut
2013-02-22T18:21:22-08:00,Steve,REMOVE,F,Noelani Haley,pulvinar arcu et pede. Nunc sed orci lobortis augue scelerisque
2013-01-22T09:54:03-08:00,Steve,ADD,F,Keegan Strong,mus. Proin vel nisl. Quisque fringilla euismod enim. Etiam gravida
2012-12-28T15:57:53-08:00,Steve,ADD,G,Rebekah Underwood,sem ut dolor dapibus gravida. Aliquam tincidunt, nunc ac mattis
2012-10-02T17:58:46-07:00,Steve,REMOVE,G,Iliana Callahan,vehicula risus. Nulla eget metus eu erat semper rutrum. Fusce
2012-05-08T17:02:37-07:00,Steve,REMOVE,G,Bertha Roman,mauris, aliquam eu, accumsan sed, facilisis vitae, orci. Phasellus dapibus
2012-05-31T07:22:46-07:00,Steve,ADD,G,Kevyn Smith,et magnis dis parturient montes, nascetur ridiculus mus. Proin vel
2012-06-20T12:38:57-07:00,Steve,ADD,G,Jeanette Terrell,pharetra nibh. Aliquam ornare, libero at auctor ullamcorper, nisl arcu
2012-10-05T19:47:54-07:00,Karen,REMOVE,I,Abigail Mccoy,Pellentesque tincidunt tempus risus. Donec egestas. Duis ac arcu. Nunc
2013-02-01T17:25:51-08:00,Karen,REMOVE,I,Barrett Oneal,euismod ac, fermentum vel, mauris. Integer sem elit, pharetra ut,
2012-08-07T19:26:03-07:00,Karen,ADD,I,Donovan Figueroa,massa. Suspendisse eleifend. Cras sed leo. Cras vehicula aliquet libero.
2012-02-16T15:28:19-08:00,Karen,ADD,I,Howard Young,consectetuer adipiscing elit. Etiam laoreet, libero et tristique pellentesque, tellus
2013-04-25T22:04:39-07:00,Karen,REMOVE,I,Jakeem Le,lacus vestibulum lorem, sit amet ultricies sem magna nec quam.
2013-04-26T20:11:15-07:00,Karen,REMOVE,T,Yuri Frye,ante. Nunc mauris sapien, cursus in, hendrerit consectetuer, cursus et,
2013-02-10T04:35:03-08:00,Karen,ADD,T,Thor Price,vel quam dignissim pharetra. Nam ac nulla. In tincidunt congue
2012-03-29T07:46:15-07:00,Karen,ADD,T,Vincent Shields,ultrices sit amet, risus. Donec nibh enim, gravida sit amet,
2012-02-15T06:54:32-08:00,Karen,REMOVE,T,Zenia Hardy,Maecenas iaculis aliquet diam. Sed diam lorem, auctor quis, tristique
2012-05-01T05:01:36-07:00,Karen,REMOVE,T,Karina Solis,luctus lobortis. Class aptent taciti sociosqu ad litora torquent per
2012-04-17T22:15:58-07:00,Michael,ADD,L,Richard Soto,augue, eu tempor erat neque non quam. Pellentesque habitant morbi
2012-05-31T15:13:33-07:00,Michael,ADD,L,Austin Weaver,molestie arcu. Sed eu nibh vulputate mauris sagittis placerat. Cras
2012-10-13T04:16:11-07:00,Michael,REMOVE,L,Amal Daugherty,a nunc. In at pede. Cras vulputate velit eu sem.
2012-03-03T05:08:34-08:00,Michael,REMOVE,L,Jada Moody,fringilla purus mauris a nunc. In at pede. Cras vulputate
2012-06-12T07:53:30-07:00,Michael,ADD,L,Daria Bradford,nec ligula consectetuer rhoncus. Nullam velit dui, semper et, lacinia
2013-01-09T16:21:58-08:00,Michael,ADD,F,Troy Blake,tristique neque venenatis lacus. Etiam bibendum fermentum metus. Aenean sed
2012-07-15T14:44:28-07:00,Michael,REMOVE,F,Josiah Wolfe,aliquet. Proin velit. Sed malesuada augue ut lacus. Nulla tincidunt,
2012-12-30T06:37:18-08:00,Michael,REMOVE,F,Colorado Vaughn,egestas rhoncus. Proin nisl sem, consequat nec, mollis vitae, posuere
2012-04-03T06:58:42-07:00,Michael,ADD,F,Oliver Valenzuela,Phasellus elit pede, malesuada vel, venenatis vel, faucibus id, libero.
2013-03-18T04:26:59-07:00,Michael,ADD,F,Barrett Holcomb,Aenean egestas hendrerit neque. In ornare sagittis felis. Donec tempor,
2012-02-16T10:05:23-08:00,Ted,REMOVE,G,George Deleon,at, velit. Pellentesque ultricies dignissim lacus. Aliquam rutrum lorem ac
2013-01-31T23:24:10-08:00,Ted,REMOVE,G,Cheyenne Frost,justo eu arcu. Morbi sit amet massa. Quisque porttitor eros
2012-06-02T01:00:01-07:00,Ted,ADD,G,Oliver Gould,magnis dis parturient montes, nascetur ridiculus mus. Proin vel nisl.
2012-09-11T21:04:23-07:00,Ted,ADD,G,Kessie Salazar,turpis vitae purus gravida sagittis. Duis gravida. Praesent eu nulla
2013-02-27T08:05:15-08:00,Ted,REMOVE,G,Glenna Baxter,luctus ut, pellentesque eget, dictum placerat, augue. Sed molestie. Sed
2012-11-15T08:54:33-08:00,Ted,REMOVE,I,Nelle Whitley,sociis natoque penatibus et magnis dis parturient montes, nascetur ridiculus
2012-08-01T16:54:27-07:00,Ted,ADD,I,Ginger Hutchinson,a, auctor non, feugiat nec, diam. Duis mi enim, condimentum
2012-10-14T16:41:33-07:00,Ted,ADD,I,Philip Ochoa,cubilia Curae; Phasellus ornare. Fusce mollis. Duis sit amet diam
2012-10-25T15:21:34-07:00,Ted,REMOVE,I,Zeph Hebert,ipsum leo elementum sem, vitae aliquam eros turpis non enim.
2013-02-27T13:32:36-08:00,Ted,REMOVE,I,Madaline Kennedy,elit, pretium et, rutrum non, hendrerit id, ante. Nunc mauris
2012-01-23T06:56:57-08:00,Ellen,ADD,T,Blaze Shields,at fringilla purus mauris a nunc. In at pede. Cras
2013-02-21T08:12:09-08:00,Ellen,ADD,T,Jaime Barker,lorem vitae odio sagittis semper. Nam tempor diam dictum sapien.
2013-02-22T11:28:03-08:00,Ellen,REMOVE,T,Piper Rhodes,Suspendisse aliquet molestie tellus. Aenean egestas hendrerit neque. In ornare
2013-04-06T12:01:37-07:00,Ellen,REMOVE,T,Duncan Francis,auctor ullamcorper, nisl arcu iaculis enim, sit amet ornare lectus
2012-10-12T01:37:21-07:00,Ellen,ADD,T,Iola Newman,semper et, lacinia vitae, sodales at, velit. Pellentesque ultricies dignissim
2012-07-22T12:33:47-07:00,Ellen,ADD,L,Myles Greer,auctor non, feugiat nec, diam. Duis mi enim, condimentum eget,
2012-01-28T03:15:34-08:00,Ellen,REMOVE,L,Adrienne Perez,Phasellus fermentum convallis ligula. Donec luctus aliquet odio. Etiam ligula
2012-07-11T11:17:24-07:00,Ellen,REMOVE,L,Fletcher James,tellus eu augue porttitor interdum. Sed auctor odio a purus.
2013-01-28T22:54:43-08:00,Ellen,ADD,L,Knox Hyde,cursus purus. Nullam scelerisque neque sed sem egestas blandit. Nam
2012-02-11T01:14:00-08:00,Ellen,ADD,L,Nigel Bowen,lorem ac risus. Morbi metus. Vivamus euismod urna. Nullam lobortis
2012-10-11T08:47:26-07:00,John,REMOVE,F,Edward Conner,mauris sit amet lorem semper auctor. Mauris vel turpis. Aliquam
2013-03-12T14:59:31-07:00,John,REMOVE,F,Bernard Moss,posuere cubilia Curae; Phasellus ornare. Fusce mollis. Duis sit amet
2012-12-17T23:36:02-08:00,John,ADD,F,Dacey Hendrix,adipiscing elit. Aliquam auctor, velit eget laoreet posuere, enim nisl
2012-01-21T06:02:14-08:00,John,ADD,F,Nola Oneil,arcu. Morbi sit amet massa. Quisque porttitor eros nec tellus.
2013-03-31T21:51:02-07:00,John,REMOVE,F,Adam Burt,sem elit, pharetra ut, pharetra sed, hendrerit a, arcu. Sed
2012-04-26T20:42:08-07:00,John,REMOVE,G,Giacomo Sampson,sociis natoque penatibus et magnis dis parturient montes, nascetur ridiculus
2012-07-30T13:23:26-07:00,John,ADD,G,Melissa Schneider,Nunc pulvinar arcu et pede. Nunc sed orci lobortis augue
2013-03-03T21:08:40-08:00,John,ADD,G,Iona Carr,dapibus id, blandit at, nisi. Cum sociis natoque penatibus et
2012-02-26T10:34:31-08:00,John,REMOVE,G,Tanek Parks,vitae, aliquet nec, imperdiet nec, leo. Morbi neque tellus, imperdiet
2012-02-23T23:38:31-08:00,John,REMOVE,G,Petra Henry,et netus et malesuada fames ac turpis egestas. Fusce aliquettimestamp,originator,action,network,target,context
2012-03-16T21:20:12-07:00,Michael,ADD,I,Vance Morton,Aliquam tincidunt, nunc ac mattis ornare, lectus ante dictum mi,
2012-06-02T04:00:46-07:00,Michael,ADD,I,Ashton Mayo,Nunc ut erat. Sed nunc est, mollis non, cursus non,
2012-05-01T17:20:57-07:00,Michael,REMOVE,I,Rogan Hensley,hendrerit neque. In ornare sagittis felis. Donec tempor, est ac
2013-01-29T15:36:08-08:00,Michael,REMOVE,I,Amery Warren,in faucibus orci luctus et ultrices posuere cubilia Curae; Phasellus
2012-04-14T11:16:58-07:00,Michael,ADD,I,Abraham Carr,ipsum primis in faucibus orci luctus et ultrices posuere cubilia
2012-04-26T14:24:52-07:00,Michael,ADD,T,Tarik Bond,iaculis, lacus pede sagittis augue, eu tempor erat neque non
2012-07-12T07:29:33-07:00,Michael,REMOVE,T,Delilah England,justo nec ante. Maecenas mi felis, adipiscing fringilla, porttitor vulputate,
2012-09-01T04:40:08-07:00,Michael,REMOVE,T,Gretchen Duke,dictum magna. Ut tincidunt orci quis lectus. Nullam suscipit, est
2012-01-10T00:01:07-08:00,Michael,ADD,T,Graiden Daugherty,sed dolor. Fusce mi lorem, vehicula et, rutrum eu, ultrices
2012-07-24T17:12:28-07:00,Michael,ADD,T,Faith Ross,lorem, sit amet ultricies sem magna nec quam. Curabitur vel
2012-12-17T09:40:46-08:00,Ted,REMOVE,L,Kessie Phelps,sollicitudin adipiscing ligula. Aenean gravida nunc sed pede. Cum sociis
2012-04-03T16:16:32-07:00,Ted,REMOVE,L,Jeanette Ross,et, euismod et, commodo at, libero. Morbi accumsan laoreet ipsum.
2013-02-08T22:48:14-08:00,Ted,ADD,L,Lane Mcmillan,lectus pede, ultrices a, auctor non, feugiat nec, diam. Duis
2013-03-24T19:36:59-07:00,Ted,ADD,L,April Mullins,augue. Sed molestie. Sed id risus quis diam luctus lobortis.
2013-04-17T14:49:11-07:00,Ted,REMOVE,L,Eliana Navarro,lacus. Nulla tincidunt, neque vitae semper egestas, urna justo faucibus
2012-03-24T15:05:59-07:00,Ted,REMOVE,F,Karleigh Madden,mauris. Suspendisse aliquet molestie tellus. Aenean egestas hendrerit neque. In
2013-03-04T18:32:01-08:00,Ted,ADD,F,Gloria Sanchez,sed consequat auctor, nunc nulla vulputate dui, nec tempus mauris
2012-10-24T12:25:35-07:00,Ted,ADD,F,Elvis Clayton,adipiscing lacus. Ut nec urna et arcu imperdiet ullamcorper. Duis
2012-03-22T11:43:43-07:00,Ted,REMOVE,F,Tana Lloyd,luctus et ultrices posuere cubilia Curae; Phasellus ornare. Fusce mollis.
2012-08-02T18:05:20-07:00,Ted,REMOVE,F,Hedda Sloan,dolor. Quisque tincidunt pede ac urna. Ut tincidunt vehicula risus.
2012-09-27T21:40:10-07:00,Ellen,ADD,G,Armand Hartman,sed consequat auctor, nunc nulla vulputate dui, nec tempus mauris
2012-03-12T10:31:11-07:00,Ellen,ADD,G,Hashim Stafford,justo. Praesent luctus. Curabitur egestas nunc sed libero. Proin sed
2013-01-22T01:31:14-08:00,Ellen,REMOVE,G,Edan Hood,quis turpis vitae purus gravida sagittis. Duis gravida. Praesent eu
2012-06-27T11:26:54-07:00,Ellen,REMOVE,G,Lester Kidd,ornare, elit elit fermentum risus, at fringilla purus mauris a
2012-09-09T18:48:23-07:00,Ellen,ADD,G,Shana Rogers,aliquam, enim nec tempus scelerisque, lorem ipsum sodales purus, in
2012-09-19T02:29:21-07:00,Ellen,ADD,I,Deacon Foster,dolor. Quisque tincidunt pede ac urna. Ut tincidunt vehicula risus.
2013-04-01T18:05:35-07:00,Ellen,REMOVE,I,Orlando Neal,In lorem. Donec elementum, lorem ut aliquam iaculis, lacus pede
2012-05-16T09:54:03-07:00,Ellen,REMOVE,I,Joan Weiss,Quisque purus sapien, gravida non, sollicitudin a, malesuada id, erat.
2013-04-05T21:10:20-07:00,Ellen,ADD,I,Jordan Simon,turpis nec mauris blandit mattis. Cras eget nisi dictum augue
2012-01-14T21:09:17-08:00,Ellen,ADD,I,Odysseus Dillard,urna justo faucibus lectus, a sollicitudin orci sem eget massa.
2012-05-10T19:57:49-07:00,John,REMOVE,T,Peter Franco,mi fringilla mi lacinia mattis. Integer eu lacus. Quisque imperdiet,
2012-06-25T16:51:23-07:00,John,REMOVE,T,Julie Owen,fringilla ornare placerat, orci lacus vestibulum lorem, sit amet ultricies
2012-11-01T13:58:59-07:00,John,ADD,T,Amos Winters,cursus non, egestas a, dui. Cras pellentesque. Sed dictum. Proin
2012-03-28T12:20:21-07:00,John,ADD,T,Clayton Maxwell,faucibus leo, in lobortis tellus justo sit amet nulla. Donec
2013-04-21T17:19:48-07:00,John,REMOVE,T,Aimee Hickman,Maecenas malesuada fringilla est. Mauris eu turpis. Nulla aliquet. Proin
2012-09-29T10:27:33-07:00,John,REMOVE,L,John Nieves,eu neque pellentesque massa lobortis ultrices. Vivamus rhoncus. Donec est.
2012-05-15T10:10:32-07:00,John,ADD,L,Karleigh Hays,Vivamus euismod urna. Nullam lobortis quam a felis ullamcorper viverra.
2012-10-19T12:38:02-07:00,John,ADD,L,Gil Swanson,diam. Duis mi enim, condimentum eget, volutpat ornare, facilisis eget,
2013-03-17T13:37:42-07:00,John,REMOVE,L,Guy Hammond,sagittis. Duis gravida. Praesent eu nulla at sem molestie sodales.
2012-01-24T18:02:30-08:00,John,REMOVE,L,Uriel Bright,malesuada augue ut lacus. Nulla tincidunt, neque vitae semper egestas,
2012-10-16T04:49:24-07:00,Steve,ADD,F,Fredericka Sloan,lacinia orci, consectetuer euismod est arcu ac orci. Ut semper
2012-01-15T01:19:38-08:00,Steve,ADD,F,Bruce Gordon,augue ut lacus. Nulla tincidunt, neque vitae semper egestas, urna
2012-10-20T03:59:02-07:00,Steve,REMOVE,F,Rhonda Heath,volutpat. Nulla dignissim. Maecenas ornare egestas ligula. Nullam feugiat placerat
2012-12-01T11:50:58-08:00,Steve,REMOVE,F,Tiger Meadows,ac, feugiat non, lobortis quis, pede. Suspendisse dui. Fusce diam
2012-10-16T08:04:26-07:00,Steve,ADD,F,Karen Mills,Vivamus nisi. Mauris nulla. Integer urna. Vivamus molestie dapibus ligula.
2012-04-21T00:24:14-07:00,Steve,ADD,G,Thomas Burgess,a, scelerisque sed, sapien. Nunc pulvinar arcu et pede. Nunc
2012-06-02T13:41:07-07:00,Steve,REMOVE,G,Linda Monroe,est tempor bibendum. Donec felis orci, adipiscing non, luctus sit
2012-06-24T05:53:38-07:00,Steve,REMOVE,G,Wing Woodard,parturient montes, nascetur ridiculus mus. Proin vel arcu eu odio
2012-02-27T03:22:58-08:00,Steve,ADD,G,Donovan Gould,ac orci. Ut semper pretium neque. Morbi quis urna. Nunc
2012-08-04T20:36:22-07:00,Steve,ADD,G,Indigo Farrell,fermentum risus, at fringilla purus mauris a nunc. In at
2012-05-14T01:59:53-07:00,Karen,REMOVE,I,Sarah Mcneil,viverra. Donec tempus, lorem fringilla ornare placerat, orci lacus vestibulum
2013-02-10T10:19:49-08:00,Karen,REMOVE,I,Kenneth Pruitt,id, erat. Etiam vestibulum massa rutrum magna. Cras convallis convallis
2012-03-27T17:24:00-07:00,Karen,ADD,I,Virginia Lott,non, bibendum sed, est. Nunc laoreet lectus quis massa. Mauris
2013-01-16T18:29:21-08:00,Karen,ADD,I,Finn Huber,erat semper rutrum. Fusce dolor quam, elementum at, egestas a,
2013-01-13T05:42:13-08:00,Karen,REMOVE,I,Dorian Whitney,ante blandit viverra. Donec tempus, lorem fringilla ornare placerat, orci
2013-03-10T05:33:03-07:00,Karen,REMOVE,T,Marshall Stephens,eu, placerat eget, venenatis a, magna. Lorem ipsum dolor sit
2013-04-15T08:05:49-07:00,Karen,ADD,T,Myra Jennings,sed leo. Cras vehicula aliquet libero. Integer in magna. Phasellus
2012-09-12T23:14:04-07:00,Karen,ADD,T,Brody Holland,ut lacus. Nulla tincidunt, neque vitae semper egestas, urna justo
2012-03-13T10:21:55-07:00,Karen,REMOVE,T,Jana Parsons,tempus mauris erat eget ipsum. Suspendisse sagittis. Nullam vitae diam.
2012-12-23T21:00:08-08:00,Karen,REMOVE,T,Catherine Campbell,erat semper rutrum. Fusce dolor quam, elementum at, egestas a,
2012-10-14T10:19:23-07:00,Michael,ADD,L,Zachary Wilder,dui. Cum sociis natoque penatibus et magnis dis parturient montes,
2012-10-13T22:57:18-07:00,Michael,ADD,L,Maryam Knowles,varius. Nam porttitor scelerisque neque. Nullam nisl. Maecenas malesuada fringilla
2012-12-12T02:06:19-08:00,Michael,REMOVE,L,Michael Howe,ante dictum mi, ac mattis velit justo nec ante. Maecenas
2012-02-12T10:45:49-08:00,Michael,REMOVE,L,Belle Riggs,Nullam feugiat placerat velit. Quisque varius. Nam porttitor scelerisque neque.
2013-02-15T02:30:17-08:00,Michael,ADD,L,Bruce Barron,dignissim lacus. Aliquam rutrum lorem ac risus. Morbi metus. Vivamus
2013-03-04T10:30:15-08:00,Michael,ADD,F,Reuben Orr,fermentum fermentum arcu. Vestibulum ante ipsum primis in faucibus orci
2012-11-06T03:30:30-08:00,Michael,REMOVE,F,Laurel Haley,ultrices. Vivamus rhoncus. Donec est. Nunc ullamcorper, velit in aliquet
2013-04-29T20:36:49-07:00,Michael,REMOVE,F,Zeph Knight,semper. Nam tempor diam dictum sapien. Aenean massa. Integer vitae
2012-06-16T15:24:57-07:00,Michael,ADD,F,Hedwig Wiley,eu metus. In lorem. Donec elementum, lorem ut aliquam iaculis,
2012-05-20T10:30:42-07:00,Michael,ADD,F,Camden Cardenas,mauris ut mi. Duis risus odio, auctor vitae, aliquet nec,
2012-05-17T19:42:50-07:00,Ted,REMOVE,G,Chase Byrd,interdum. Nunc sollicitudin commodo ipsum. Suspendisse non leo. Vivamus nibh
2012-03-31T02:15:28-07:00,Ted,REMOVE,G,Savannah Robertson,eu tellus eu augue porttitor interdum. Sed auctor odio a
2012-09-02T06:43:29-07:00,Ted,ADD,G,Cora Hubbard,ipsum. Curabitur consequat, lectus sit amet luctus vulputate, nisi sem
2012-07-24T09:02:24-07:00,Ted,ADD,G,Cameron Luna,sit amet ultricies sem magna nec quam. Curabitur vel lectus.
2012-09-08T17:49:41-07:00,Ted,REMOVE,G,Kennedy Odom,Nunc quis arcu vel quam dignissim pharetra. Nam ac nulla.
2012-10-29T02:20:25-07:00,Ted,REMOVE,I,Tamekah Johnson,egestas, urna justo faucibus lectus, a sollicitudin orci sem eget
2012-04-02T04:29:21-07:00,Ted,ADD,I,Bradley Becker,placerat eget, venenatis a, magna. Lorem ipsum dolor sit amet,
2012-10-21T21:17:37-07:00,Ted,ADD,I,Rogan Baxter,Aliquam ornare, libero at auctor ullamcorper, nisl arcu iaculis enim,
2012-04-01T19:36:29-07:00,Ted,REMOVE,I,Vladimir House,Class aptent taciti sociosqu ad litora torquent per conubia nostra,
2012-10-24T20:20:32-07:00,Ted,REMOVE,I,Ramona Mcintyre,neque vitae semper egestas, urna justo faucibus lectus, a sollicitudin
2012-02-10T18:37:50-08:00,Ellen,ADD,T,Phyllis Rogers,molestie arcu. Sed eu nibh vulputate mauris sagittis placerat. Cras
2012-02-05T04:37:34-08:00,Ellen,ADD,T,Nero Merritt,nec, diam. Duis mi enim, condimentum eget, volutpat ornare, facilisis
2012-02-14T18:08:01-08:00,Ellen,REMOVE,T,Cameran Short,dolor. Nulla semper tellus id nunc interdum feugiat. Sed nec
2012-01-10T00:08:11-08:00,Ellen,REMOVE,T,Ann Young,diam. Duis mi enim, condimentum eget, volutpat ornare, facilisis eget,
2012-08-29T00:56:29-07:00,Ellen,ADD,T,Ora Lindsey,amet, consectetuer adipiscing elit. Aliquam auctor, velit eget laoreet posuere,
2012-09-01T06:13:57-07:00,Ellen,ADD,L,Ishmael Hobbs,enim nec tempus scelerisque, lorem ipsum sodales purus, in molestie
2012-09-10T22:11:17-07:00,Ellen,REMOVE,L,Sheila Livingston,euismod enim. Etiam gravida molestie arcu. Sed eu nibh vulputate
2013-04-28T19:40:01-07:00,Ellen,REMOVE,L,Mallory Gonzalez,et, rutrum non, hendrerit id, ante. Nunc mauris sapien, cursus
2012-08-29T08:39:26-07:00,Ellen,ADD,L,Ursa Flores,Quisque tincidunt pede ac urna. Ut tincidunt vehicula risus. Nulla
2012-09-20T02:26:08-07:00,Ellen,ADD,L,Charles Blair,augue eu tellus. Phasellus elit pede, malesuada vel, venenatis vel,
2013-02-05T06:11:55-08:00,John,REMOVE,F,Leonard Serrano,Suspendisse eleifend. Cras sed leo. Cras vehicula aliquet libero. Integer
2012-03-19T07:10:21-07:00,John,REMOVE,F,Brent Lester,metus eu erat semper rutrum. Fusce dolor quam, elementum at,
2012-06-08T02:10:07-07:00,John,ADD,F,Inga Olsen,volutpat. Nulla facilisis. Suspendisse commodo tincidunt nibh. Phasellus nulla. Integer
2012-03-03T16:54:41-08:00,John,ADD,F,Ciara Prince,amet metus. Aliquam erat volutpat. Nulla facilisis. Suspendisse commodo tincidunt
2012-08-27T23:39:48-07:00,John,REMOVE,F,Kane James,eget massa. Suspendisse eleifend. Cras sed leo. Cras vehicula aliquet
2012-01-26T08:43:37-08:00,John,REMOVE,G,Kaden Valenzuela,metus. In lorem. Donec elementum, lorem ut aliquam iaculis, lacus
2012-08-13T06:54:19-07:00,John,ADD,G,Yoko Richmond,Vivamus molestie dapibus ligula. Aliquam erat volutpat. Nulla dignissim. Maecenas
2012-04-04T01:20:57-07:00,John,ADD,G,Kaitlin Head,Donec at arcu. Vestibulum ante ipsum primis in faucibus orci
2013-02-25T02:34:32-08:00,John,REMOVE,G,Barry Garrison,erat. Etiam vestibulum massa rutrum magna. Cras convallis convallis dolor.
2012-05-04T08:37:41-07:00,John,REMOVE,G,Breanna Lancaster,sit amet risus. Donec egestas. Aliquam nec enim. Nunc uttimestamp,originator,action,network,target,context
2012-08-24T14:49:56-07:00,Michael,ADD,I,Jin Hickman,Duis at lacus. Quisque purus sapien, gravida non, sollicitudin a,
2012-02-22T19:32:52-08:00,Michael,ADD,I,Quyn Olsen,est. Mauris eu turpis. Nulla aliquet. Proin velit. Sed malesuada
2012-03-31T07:23:31-07:00,Michael,REMOVE,I,Doris Aguirre,facilisis lorem tristique aliquet. Phasellus fermentum convallis ligula. Donec luctus
2013-04-21T23:39:38-07:00,Michael,REMOVE,I,Sylvester Rodgers,pharetra, felis eget varius ultrices, mauris ipsum porta elit, a
2012-04-26T07:28:36-07:00,Michael,ADD,I,Baxter Mays,sed consequat auctor, nunc nulla vulputate dui, nec tempus mauris
2013-03-28T13:17:46-07:00,Michael,ADD,T,Kitra Rivers,ipsum leo elementum sem, vitae aliquam eros turpis non enim.
2012-12-02T04:26:39-08:00,Michael,REMOVE,T,Tobias Glass,metus vitae velit egestas lacinia. Sed congue, elit sed consequat
2013-02-05T11:48:36-08:00,Michael,REMOVE,T,Neville Mercado,sed, est. Nunc laoreet lectus quis massa. Mauris vestibulum, neque
2012-09-24T12:24:15-07:00,Michael,ADD,T,Conan Little,dolor sit amet, consectetuer adipiscing elit. Aliquam auctor, velit eget
2012-04-05T12:55:15-07:00,Michael,ADD,T,Garrison Buchanan,a mi fringilla mi lacinia mattis. Integer eu lacus. Quisque
2012-04-19T14:34:37-07:00,Ted,REMOVE,L,Sean Mcgowan,urna suscipit nonummy. Fusce fermentum fermentum arcu. Vestibulum ante ipsum
2012-10-30T04:31:21-07:00,Ted,REMOVE,L,Sheila Gross,sit amet luctus vulputate, nisi sem semper erat, in consectetuer
2012-07-22T19:07:16-07:00,Ted,ADD,L,Daryl Morgan,consectetuer ipsum nunc id enim. Curabitur massa. Vestibulum accumsan neque
2013-03-25T09:09:05-07:00,Ted,ADD,L,Ainsley Leach,pellentesque massa lobortis ultrices. Vivamus rhoncus. Donec est. Nunc ullamcorper,
2012-05-20T06:44:02-07:00,Ted,REMOVE,L,Shaine Mercer,ornare. In faucibus. Morbi vehicula. Pellentesque tincidunt tempus risus. Donec
2013-03-29T11:34:50-07:00,Ted,REMOVE,F,Lilah Clarke,sed orci lobortis augue scelerisque mollis. Phasellus libero mauris, aliquam
2012-05-09T15:42:26-07:00,Ted,ADD,F,Penelope Bowen,nisl. Maecenas malesuada fringilla est. Mauris eu turpis. Nulla aliquet.
2013-01-17T19:33:12-08:00,Ted,ADD,F,Joseph Rollins,urna et arcu imperdiet ullamcorper. Duis at lacus. Quisque purus
2013-03-03T21:15:13-08:00,Ted,REMOVE,F,Upton Alexander,dapibus rutrum, justo. Praesent luctus. Curabitur egestas nunc sed libero.
2012-05-25T13:14:51-07:00,Ted,REMOVE,F,Troy Gonzales,venenatis lacus. Etiam bibendum fermentum metus. Aenean sed pede nec
2012-11-24T00:55:56-08:00,Ellen,ADD,G,Nora Collier,dictum placerat, augue. Sed molestie. Sed id risus quis diam
2012-05-07T17:36:29-07:00,Ellen,ADD,G,Vielka Barr,aliquet, metus urna convallis erat, eget tincidunt dui augue eu
2012-03-07T21:39:55-08:00,Ellen,REMOVE,G,Seth Finley,ad litora torquent per conubia nostra, per inceptos hymenaeos. Mauris
2012-01-23T20:56:39-08:00,Ellen,REMOVE,G,Phoebe Francis,elit. Etiam laoreet, libero et tristique pellentesque, tellus sem mollis
2012-04-04T00:11:41-07:00,Ellen,ADD,G,Jack Carver,a sollicitudin orci sem eget massa. Suspendisse eleifend. Cras sed
2012-12-09T22:28:36-08:00,Ellen,ADD,I,Olga Rasmussen,ante. Nunc mauris sapien, cursus in, hendrerit consectetuer, cursus et,
2012-05-11T09:22:30-07:00,Ellen,REMOVE,I,Quyn King,orci lacus vestibulum lorem, sit amet ultricies sem magna nec
