timestamp,originator,action,network,target,context
2012-12-10T12:35:19-08:00,Ellen,REMOVE,I,Carolyn Yates,purus. Duis elementum, dui quis accumsan convallis, ante lectus convallis
2012-07-24T13:49:20-07:00,Ellen,ADD,I,Cecilia Vance,nisi magna sed dui. Fusce aliquam, enim nec tempus scelerisque,
2013-03-18T09:28:15-07:00,Ellen,ADD,I,Odessa Sexton,In at pede. Cras vulputate velit eu sem. Pellentesque ut
2013-04-02T08:53:39-07:00,John,REMOVE,T,Hanae Luna,aliquam adipiscing lacus. Ut nec urna et arcu imperdiet ullamcorper.
2012-04-14T10:05:43-07:00,John,REMOVE,T,Malcolm Justice,Nunc sed orci lobortis augue scelerisque mollis. Phasellus libero mauris,
2012-05-30T02:18:05-07:00,John,ADD,T,Declan Garrison,vel arcu eu odio tristique pharetra. Quisque ac libero nec
2012-07-24T09:49:00-07:00,John,ADD,T,Karyn Boone,tempus non, lacinia at, iaculis quis, pede. Praesent eu dui.
2012-03-28T22:10:46-07:00,John,REMOVE,T,Evan Lindsay,libero et tristique pellentesque, tellus sem mollis dui, in sodales
2013-04-10T13:15:02-07:00,John,REMOVE,L,Norman Duran,iaculis nec, eleifend non, dapibus rutrum, justo. Praesent luctus. Curabitur
2012-09-04T07:17:00-07:00,John,ADD,L,Erasmus Ball,Nunc pulvinar arcu et pede. Nunc sed orci lobortis augue
2012-01-18T09:34:25-08:00,John,ADD,L,Xerxes Conway,elementum at, egestas a, scelerisque sed, sapien. Nunc pulvinar arcu
2012-10-28T14:30:58-07:00,John,REMOVE,L,Indigo Guy,dui. Fusce diam nunc, ullamcorper eu, euismod ac, fermentum vel,
2012-06-24T21:00:37-07:00,John,REMOVE,L,Tatyana Bradley,consectetuer adipiscing elit. Etiam laoreet, libero et tristique pellentesque, tellus
2013-02-16T23:48:35-08:00,Steve,ADD,F,Nyssa Jenkins,tristique pharetra. Quisque ac libero nec ligula consectetuer rhoncus. Nullam
2012-03-12T08:01:55-07:00,Steve,ADD,F,Olga Brown,Pellentesque ut ipsum ac mi eleifend egestas. Sed pharetra, felis
2012-10-20T15:15:56-07:00,Steve,REMOVE,F,Quyn Green,aliquam eros turpis non enim. Mauris quis turpis vitae purus
2012-11-11T10:19:09-08:00,Steve,REMOVE,F,Blake Stokes,Duis sit amet diam eu dolor egestas rhoncus. Proin nisl
2012-04-13T13:08:43-07:00,Steve,ADD,F,Pearl Cohen,lorem tristique aliquet. Phasellus fermentum convallis ligula. Donec luctus aliquet
2012-03-01T02:26:05-08:00,Steve,ADD,G,Kenyon Townsend,vehicula risus. Nulla eget metus eu erat semper rutrum. Fusce
2012-06-30T02:52:38-07:00,Steve,REMOVE,G,Axel Cote,et netus et malesuada fames ac turpis egestas. Fusce aliquet
2012-08-15T13:56:23-07:00,Steve,REMOVE,G,Britanni Clayton,sociosqu ad litora torquent per conubia nostra, per inceptos hymenaeos.
2012-09-19T00:46:22-07:00,Steve,ADD,G,Caryn Mcneil,Donec consectetuer mauris id sapien. Cras dolor dolor, tempus non,
2012-12-12T06:15:30-08:00,Steve,ADD,G,Brianna Knowles,Vestibulum ante ipsum primis in faucibus orci luctus et ultrices
2012-12-25T09:47:12-08:00,Karen,REMOVE,I,Trevor Dawson,Aliquam adipiscing lobortis risus. In mi pede, nonummy ut, molestie
2012-01-03T14:51:54-08:00,Karen,REMOVE,I,Dean Webb,lectus pede, ultrices a, auctor non, feugiat nec, diam. Duis
2012-01-11T11:34:43-08:00,Karen,ADD,I,Athena Phillips,lorem fringilla ornare placerat, orci lacus vestibulum lorem, sit amet
2012-04-25T02:28:30-07:00,Karen,ADD,I,Curran Shannon,non, dapibus rutrum, justo. Praesent luctus. Curabitur egestas nunc sed
2012-11-01T14:02:44-07:00,Karen,REMOVE,I,Jane Mccarthy,faucibus orci luctus et ultrices posuere cubilia Curae; Donec tincidunt.
2013-02-27T00:16:47-08:00,Karen,REMOVE,T,Damon Burns,Donec consectetuer mauris id sapien. Cras dolor dolor, tempus non,
2012-02-16T21:37:19-08:00,Karen,ADD,T,Dillon Cotton,Donec elementum, lorem ut aliquam iaculis, lacus pede sagittis augue,
2012-05-14T12:00:10-07:00,Karen,ADD,T,Fuller Gentry,sapien, gravida non, sollicitudin a, malesuada id, erat. Etiam vestibulum
2013-01-10T17:21:38-08:00,Karen,REMOVE,T,Levi Kinney,dui augue eu tellus. Phasellus elit pede, malesuada vel, venenatis
2012-06-01T06:04:22-07:00,Karen,REMOVE,T,Dahlia Miles,sapien. Aenean massa. Integer vitae nibh. Donec est mauris, rhoncus
2012-02-21T11:39:29-08:00,Michael,ADD,L,Wing Lloyd,Maecenas iaculis aliquet diam. Sed diam lorem, auctor quis, tristique
2012-11-27T01:01:40-08:00,Michael,ADD,L,Carl Roman,condimentum eget, volutpat ornare, facilisis eget, ipsum. Donec sollicitudin adipiscing
2012-12-06T17:55:51-08:00,Michael,REMOVE,L,Jasper Spence,a, scelerisque sed, sapien. Nunc pulvinar arcu et pede. Nunc
2012-09-05T23:07:58-07:00,Michael,REMOVE,L,Buckminster Boyer,nunc sit amet metus. Aliquam erat volutpat. Nulla facilisis. Suspendisse
2012-01-30T21:03:20-08:00,Michael,ADD,L,Morgan Macias,augue porttitor interdum. Sed auctor odio a purus. Duis elementum,
2013-03-27T17:28:56-07:00,Michael,ADD,F,Hu Rollins,tellus non magna. Nam ligula elit, pretium et, rutrum non,
2012-06-27T18:52:08-07:00,Michael,REMOVE,F,Amos Becker,eu, placerat eget, venenatis a, magna. Lorem ipsum dolor sit
2013-04-06T02:55:44-07:00,Michael,REMOVE,F,Tamekah Harrell,Aliquam vulputate ullamcorper magna. Sed eu eros. Nam consequat dolor
2012-04-30T12:55:28-07:00,Michael,ADD,F,Theodore Wood,bibendum ullamcorper. Duis cursus, diam at pretium aliquet, metus urna
2013-01-27T08:06:36-08:00,Michael,ADD,F,Keith Cunningham,nisl sem, consequat nec, mollis vitae, posuere at, velit. Cras
2012-02-14T21:59:25-08:00,Ted,REMOVE,G,Meredith Clark,eget, venenatis a, magna. Lorem ipsum dolor sit amet, consectetuer
2012-04-27T13:25:56-07:00,Ted,REMOVE,G,Ali Gibbs,commodo hendrerit. Donec porttitor tellus non magna. Nam ligula elit,
2012-04-10T19:07:58-07:00,Ted,ADD,G,Genevieve Russell,consequat enim diam vel arcu. Curabitur ut odio vel est
2012-06-21T17:15:43-07:00,Ted,ADD,G,Haviva Walters,fringilla euismod enim. Etiam gravida molestie arcu. Sed eu nibh
2012-03-16T17:21:28-07:00,Ted,REMOVE,G,Desiree Meyers,ultrices iaculis odio. Nam interdum enim non nisi. Aenean eget
2012-06-25T12:56:53-07:00,Ted,REMOVE,I,Nyssa Barlow,ultrices. Duis volutpat nunc sit amet metus. Aliquam erat volutpat.
2012-11-24T09:48:06-08:00,Ted,ADD,I,Elvis Bowers,mattis ornare, lectus ante dictum mi, ac mattis velit justo
2012-12-26T04:36:45-08:00,Ted,ADD,I,Audrey Williamson,ipsum. Donec sollicitudin adipiscing ligula. Aenean gravida nunc sed pede.
2012-02-02T14:47:39-08:00,Ted,REMOVE,I,Cherokee Stuart,porttitor eros nec tellus. Nunc lectus pede, ultrices a, auctor
2012-05-25T05:40:35-07:00,Ted,REMOVE,I,Roanna Herrera,penatibus et magnis dis parturient montes, nascetur ridiculus mus. Proin
2012-01-21T02:18:48-08:00,Ellen,ADD,T,Amy Bond,neque pellentesque massa lobortis ultrices. Vivamus rhoncus. Donec est. Nunc
2012-01-14T05:20:04-08:00,Ellen,ADD,T,Savannah Buchanan,Ut tincidunt vehicula risus. Nulla eget metus eu erat semper
2012-01-22T15:57:34-08:00,Ellen,REMOVE,T,Hollee Humphrey,a feugiat tellus lorem eu metus. In lorem. Donec elementum,
2013-02-02T18:51:49-08:00,Ellen,REMOVE,T,Shafira Simon,fermentum convallis ligula. Donec luctus aliquet odio. Etiam ligula tortor,
2012-02-19T11:06:19-08:00,Ellen,ADD,T,Hall Bryan,Proin velit. Sed malesuada augue ut lacus. Nulla tincidunt, neque
2012-10-02T08:46:59-07:00,Ellen,ADD,L,Jakeem Scott,varius orci, in consequat enim diam vel arcu. Curabitur ut
2012-07-28T04:24:13-07:00,Ellen,REMOVE,L,Francis Burris,dis parturient montes, nascetur ridiculus mus. Proin vel nisl. Quisque
2013-02-10T20:43:04-08:00,Ellen,REMOVE,L,Denton Cook,luctus felis purus ac tellus. Suspendisse sed dolor. Fusce mi
2012-09-08T22:18:12-07:00,Ellen,ADD,L,Laurel Harper,dignissim. Maecenas ornare egestas ligula. Nullam feugiat placerat velit. Quisque
2012-12-28T15:32:25-08:00,Ellen,ADD,L,Sylvia Cook,mollis dui, in sodales elit erat vitae risus. Duis a
2012-01-20T00:45:32-08:00,John,REMOVE,F,Hillary Douglas,Aliquam erat volutpat. Nulla facilisis. Suspendisse commodo tincidunt nibh. Phasellus
2012-11-29T21:53:55-08:00,John,REMOVE,F,Bert Booker,dolor. Fusce feugiat. Lorem ipsum dolor sit amet, consectetuer adipiscing
2013-02-04T12:50:19-08:00,John,ADD,F,Brooke Keller,non, luctus sit amet, faucibus ut, nulla. Cras eu tellus
2012-06-27T12:19:47-07:00,John,ADD,F,Xandra Gibson,nisl arcu iaculis enim, sit amet ornare lectus justo eu
2013-01-12T14:04:59-08:00,John,REMOVE,F,Pamela Paul,neque vitae semper egestas, urna justo faucibus lectus, a sollicitudin
2013-02-26T01:17:11-08:00,John,REMOVE,G,Burton Chavez,et ultrices posuere cubilia Curae; Phasellus ornare. Fusce mollis. Duis
2012-08-22T03:30:45-07:00,John,ADD,G,Lareina Kidd,lorem ac risus. Morbi metus. Vivamus euismod urna. Nullam lobortis
2013-04-23T19:15:33-07:00,John,ADD,G,Benedict Reid,sed libero. Proin sed turpis nec mauris blandit mattis. Cras
2013-04-13T04:17:36-07:00,John,REMOVE,G,Libby Gilbert,vulputate, posuere vulputate, lacus. Cras interdum. Nunc sollicitudin commodo ipsum.
2012-08-12T14:53:16-07:00,John,REMOVE,G,Yoko Daniels,est mauris, rhoncus id, mollis nec, cursus a, enim. Suspendisse