timestamp,originator,action,network,target,context
2012-03-12T22:54:13-07:00,Michael,ADD,I,Ora Hatfield,consequat enim diam vel arcu. Curabitur ut odio vel est
2012-10-05T01:30:42-07:00,Michael,ADD,I,Rafael Baldwin,nibh. Aliquam ornare, libero at auctor ullamcorper, nisl arcu iaculis
2012-11-23T01:53:42-08:00,Michael,REMOVE,I,Marvin Garrison,Cras interdum. Nunc sollicitudin commodo ipsum. Suspendisse non leo. Vivamus
2012-08-13T21:47:53-07:00,Michael,REMOVE,I,Ayanna Jacobs,blandit mattis. Cras eget nisi dictum augue malesuada malesuada. Integer
2012-08-23T20:45:28-07:00,Michael,ADD,I,Jordan Warner,lacus. Aliquam rutrum lorem ac risus. Morbi metus. Vivamus euismod
2012-03-02T12:41:35-08:00,Michael,ADD,T,Price Cunningham,non, luctus sit amet, faucibus ut, nulla. Cras eu tellus
2012-02-29T07:41:48-08:00,Michael,REMOVE,T,Diana Burns,feugiat nec, diam. Duis mi enim, condimentum eget, volutpat ornare,
2013-01-22T00:15:33-08:00,Michael,REMOVE,T,Aileen Allen,convallis convallis dolor. Quisque tincidunt pede ac urna. Ut tincidunt
2013-04-28T21:19:44-07:00,Michael,ADD,T,Ahmed Thompson,pharetra. Nam ac nulla. In tincidunt congue turpis. In condimentum.
2013-02-16T10:51:11-08:00,Michael,ADD,T,Barrett Pitts,urna. Ut tincidunt vehicula risus. Nulla eget metus eu erat
2013-02-06T00:11:02-08:00,Ted,REMOVE,L,Aspen Hunt,laoreet lectus quis massa. Mauris vestibulum, neque sed dictum eleifend,
2013-02-17T21:18:35-08:00,Ted,REMOVE,L,Kamal Delgado,a purus. Duis elementum, dui quis accumsan convallis, ante lectus
2012-10-03T20:21:12-07:00,Ted,ADD,L,Rhona Summers,amet, consectetuer adipiscing elit. Etiam laoreet, libero et tristique pellentesque,
2012-06-21T23:15:55-07:00,Ted,ADD,L,Patricia Wiley,id risus quis diam luctus lobortis. Class aptent taciti sociosqu
2012-05-06T14:34:35-07:00,Ted,REMOVE,L,Emmanuel Hutchinson,Aliquam adipiscing lobortis risus. In mi pede, nonummy ut, molestie
2012-09-01T13:19:12-07:00,Ted,REMOVE,F,Mason Davidson,vehicula aliquet libero. Integer in magna. Phasellus dolor elit, pellentesque
2012-06-26T02:32:25-07:00,Ted,ADD,F,Bernard Keller,dictum ultricies ligula. Nullam enim. Sed nulla ante, iaculis nec,
2012-11-24T07:23:36-08:00,Ted,ADD,F,Howard Knapp,luctus. Curabitur egestas nunc sed libero. Proin sed turpis nec
2013-04-03T19:48:28-07:00,Ted,REMOVE,F,Ira Larsen,adipiscing non, luctus sit amet, faucibus ut, nulla. Cras eu
2012-07-13T00:30:39-07:00,Ted,REMOVE,F,Candice Mcpherson,augue id ante dictum cursus. Nunc mauris elit, dictum eu,
2012-03-24T06:28:03-07:00,Ellen,ADD,G,Chastity Oliver,id sapien. Cras dolor dolor, tempus non, lacinia at, iaculis
2012-12-14T20:04:55-08:00,Ellen,ADD,G,MacKensie Conley,ultrices. Duis volutpat nunc sit amet metus. Aliquam erat volutpat.
2012-08-07T09:28:21-07:00,Ellen,REMOVE,G,Audra Wynn,erat eget ipsum. Suspendisse sagittis. Nullam vitae diam. Proin dolor.
2012-04-25T11:31:54-07:00,Ellen,REMOVE,G,Sloane Pratt,Vestibulum ante ipsum primis in faucibus orci luctus et ultrices
2012-04-15T02:42:03-07:00,Ellen,ADD,G,Brenna Barnes,tempor augue ac ipsum. Phasellus vitae mauris sit amet lorem
2012-12-15T04:11:25-08:00,Ellen,ADD,I,Flavia Ortiz,aliquet libero. Integer in magna. Phasellus dolor elit, pellentesque a,
2013-02-04T16:55:55-08:00,Ellen,REMOVE,I,Palmer Romero,nisi sem semper erat, in consectetuer ipsum nunc id enim.
2012-03-25T05:30:43-07:00,Ellen,REMOVE,I,Duncan Cote,leo. Cras vehicula aliquet libero. Integer in magna. Phasellus dolor
2013-02-24T18:48:24-08:00,Ellen,ADD,I,Samantha Morgan,Maecenas mi felis, adipiscing fringilla, porttitor vulputate, posuere vulputate, lacus.
2012-07-05T09:23:21-07:00,Ellen,ADD,I,Dorothy Roy,Praesent luctus. Curabitur egestas nunc sed libero. Proin sed turpis
2012-06-18T05:11:21-07:00,John,REMOVE,T,Jacob Wooten,ultrices posuere cubilia Curae; Phasellus ornare. Fusce mollis. Duis sit
2013-01-01T11:07:04-08:00,John,REMOVE,T,Barry Mclean,non, bibendum sed, est. Nunc laoreet lectus quis massa. Mauris
2013-02-22T10:01:42-08:00,John,ADD,T,Wylie Odom,Integer in magna. Phasellus dolor elit, pellentesque a, facilisis non,
2012-03-01T02:56:17-08:00,John,ADD,T,Octavius Love,turpis vitae purus gravida sagittis. Duis gravida. Praesent eu nulla
2013-03-28T10:41:44-07:00,John,REMOVE,T,Ivory Nguyen,mauris sit amet lorem semper auctor. Mauris vel turpis. Aliquam
2012-07-22T18:46:45-07:00,John,REMOVE,L,Mariko Woods,ultricies adipiscing, enim mi tempor lorem, eget mollis lectus pede
2012-10-25T21:30:52-07:00,John,ADD,L,Anthony Pierce,lectus. Cum sociis natoque penatibus et magnis dis parturient montes,
2012-06-13T16:13:30-07:00,John,ADD,L,Xantha Aguirre,nulla. Integer vulputate, risus a ultricies adipiscing, enim mi tempor
2012-12-22T09:29:05-08:00,John,REMOVE,L,Harlan Sharp,mus. Proin vel nisl. Quisque fringilla euismod enim. Etiam gravida
2012-10-07T14:49:46-07:00,John,REMOVE,L,Finn Bryan,sociis natoque penatibus et magnis dis parturient montes, nascetur ridiculus
2012-03-18T08:16:30-07:00,Steve,ADD,F,Stacey Marquez,eget, volutpat ornare, facilisis eget, ipsum. Donec sollicitudin adipiscing ligula.
2013-01-07T20:43:46-08:00,Steve,ADD,F,Bert Moss,Nunc ac sem ut dolor dapibus gravida. Aliquam tincidunt, nunc
2012-04-12T12:49:44-07:00,Steve,REMOVE,F,Keane Melendez,facilisis, magna tellus faucibus leo, in lobortis tellus justo sit
2013-01-03T12:32:37-08:00,Steve,REMOVE,F,Walker Gibbs,cursus luctus, ipsum leo elementum sem, vitae aliquam eros turpis
2013-04-26T04:09:51-07:00,Steve,ADD,F,Bertha Rodgers,risus, at fringilla purus mauris a nunc. In at pede.
2013-04-10T19:58:16-07:00,Steve,ADD,G,Emery Hobbs,Duis a mi fringilla mi lacinia mattis. Integer eu lacus.
2012-04-10T05:22:27-07:00,Steve,REMOVE,G,Charissa Joyner,fringilla euismod enim. Etiam gravida molestie arcu. Sed eu nibh
2012-06-18T13:12:46-07:00,Steve,REMOVE,G,Sloane Hubbard,nibh vulputate mauris sagittis placerat. Cras dictum ultricies ligula. Nullam
2012-10-10T21:31:21-07:00,Steve,ADD,G,Pearl Sharp,tristique ac, eleifend vitae, erat. Vivamus nisi. Mauris nulla. Integer
2012-04-05T19:38:11-07:00,Steve,ADD,G,Dorian Casey,tortor nibh sit amet orci. Ut sagittis lobortis mauris. Suspendisse
2013-02-23T19:53:45-08:00,Karen,REMOVE,I,Lillian Avery,egestas a, scelerisque sed, sapien. Nunc pulvinar arcu et pede.
2012-08-23T12:35:02-07:00,Karen,REMOVE,I,Tyrone Burton,Aliquam nisl. Nulla eu neque pellentesque massa lobortis ultrices. Vivamus
2012-04-14T01:56:54-07:00,Karen,ADD,I,Sebastian Mosley,Nunc lectus pede, ultrices a, auctor non, feugiat nec, diam.
2012-10-14T18:44:01-07:00,Karen,ADD,I,Isabella Mcgowan,iaculis quis, pede. Praesent eu dui. Cum sociis natoque penatibus
2013-01-19T04:36:52-08:00,Karen,REMOVE,I,Leroy Pacheco,Nunc laoreet lectus quis massa. Mauris vestibulum, neque sed dictum
2013-01-26T09:44:51-08:00,Karen,REMOVE,T,Hilel Yates,et netus et malesuada fames ac turpis egestas. Aliquam fringilla
2012-03-07T21:55:29-08:00,Karen,ADD,T,Claudia Cleveland,tristique pharetra. Quisque ac libero nec ligula consectetuer rhoncus. Nullam
2012-04-18T08:29:07-07:00,Karen,ADD,T,Orli Barry,consectetuer adipiscing elit. Etiam laoreet, libero et tristique pellentesque, tellus
2012-05-07T14:43:06-07:00,Karen,REMOVE,T,Dominic Romero,erat, eget tincidunt dui augue eu tellus. Phasellus elit pede,
2012-03-08T20:22:42-08:00,Karen,REMOVE,T,Margaret Berg,odio. Etiam ligula tortor, dictum eu, placerat eget, venenatis a,
2012-12-23T09:44:46-08:00,Michael,ADD,L,Brenda Nichols,mi fringilla mi lacinia mattis. Integer eu lacus. Quisque imperdiet,
2013-02-21T06:36:18-08:00,Michael,ADD,L,Cara Mcclain,tincidunt, nunc ac mattis ornare, lectus ante dictum mi, ac
2012-04-05T15:13:42-07:00,Michael,REMOVE,L,Sheila Hill,Nam ligula elit, pretium et, rutrum non, hendrerit id, ante.
2012-09-03T19:16:15-07:00,Michael,REMOVE,L,Carissa Spence,vulputate eu, odio. Phasellus at augue id ante dictum cursus.
2012-05-06T08:36:02-07:00,Michael,ADD,L,Ria Huffman,eros. Proin ultrices. Duis volutpat nunc sit amet metus. Aliquam
2013-03-24T12:14:21-07:00,Michael,ADD,F,Dahlia Solomon,magna, malesuada vel, convallis in, cursus et, eros. Proin ultrices.
2012-07-14T02:56:55-07:00,Michael,REMOVE,F,Avram Benton,pede. Nunc sed orci lobortis augue scelerisque mollis. Phasellus libero
2012-03-05T14:16:31-08:00,Michael,REMOVE,F,Ifeoma Rowe,orci. Donec nibh. Quisque nonummy ipsum non arcu. Vivamus sit
2012-12-26T20:11:49-08:00,Michael,ADD,F,Clio Berry,Phasellus nulla. Integer vulputate, risus a ultricies adipiscing, enim mi
2012-05-06T04:44:15-07:00,Michael,ADD,F,Sasha Patel,non leo. Vivamus nibh dolor, nonummy ac, feugiat non, lobortis
2013-01-12T17:52:53-08:00,Ted,REMOVE,G,Luke Schultz,massa non ante bibendum ullamcorper. Duis cursus, diam at pretium
2012-03-23T08:38:01-07:00,Ted,REMOVE,G,Hu Wong,amet lorem semper auctor. Mauris vel turpis. Aliquam adipiscing lobortis
2012-12-04T09:50:44-08:00,Ted,ADD,G,Garrison Shaw,at pretium aliquet, metus urna convallis erat, eget tincidunt dui
2012-06-15T09:27:33-07:00,Ted,ADD,G,Uma Yates,Suspendisse aliquet molestie tellus. Aenean egestas hendrerit neque. In ornare
2012-01-02T07:17:10-08:00,Ted,REMOVE,G,Beau Rowe,adipiscing fringilla, porttitor vulputate, posuere vulputate, lacus. Cras interdum. Nunc
2012-05-08T12:00:36-07:00,Ted,REMOVE,I,Xander Ayers,elit erat vitae risus. Duis a mi fringilla mi lacinia
2012-12-30T01:37:41-08:00,Ted,ADD,I,Sarah Bryant,sed sem egestas blandit. Nam nulla magna, malesuada vel, convallis
2012-09-28T22:14:31-07:00,Ted,ADD,I,Susan Leonard,metus. Aenean sed pede nec ante blandit viverra. Donec tempus,
2012-02-06T07:58:59-08:00,Ted,REMOVE,I,Xena Preston,ipsum primis in faucibus orci luctus et ultrices posuere cubilia
2013-02-06T17:13:09-08:00,Ted,REMOVE,I,Shelley Maxwell,in consequat enim diam vel arcu. Curabitur ut odio vel
2012-04-21T14:37:32-07:00,Ellen,ADD,T,Ria Coffey,taciti sociosqu ad litora torquent per conubia nostra, per inceptos
2013-01-31T18:16:32-08:00,Ellen,ADD,T,Hyatt Mcintyre,posuere at, velit. Cras lorem lorem, luctus ut, pellentesque eget,
2012-07-05T20:53:16-07:00,Ellen,REMOVE,T,Lynn Walter,ultrices iaculis odio. Nam interdum enim non nisi. Aenean eget
2012-06-01T01:40:49-07:00,Ellen,REMOVE,T,Damian Solomon,mollis. Integer tincidunt aliquam arcu. Aliquam ultrices iaculis odio. Nam
2012-11-25T22:13:01-08:00,Ellen,ADD,T,Ocean Webster,metus. Aliquam erat volutpat. Nulla facilisis. Suspendisse commodo tincidunt nibh.
2013-02-19T00:58:52-08:00,Ellen,ADD,L,Mechelle Vargas,consequat, lectus sit amet luctus vulputate, nisi sem semper erat,
2013-02-26T05:04:42-08:00,Ellen,REMOVE,L,Jaime Rasmussen,Quisque purus sapien, gravida non, sollicitudin a, malesuada id, erat.
2012-09-26T00:41:01-07:00,Ellen,REMOVE,L,Ferris Molina,eleifend non, dapibus rutrum, justo. Praesent luctus. Curabitur egestas nunc
2013-01-06T02:55:07-08:00,Ellen,ADD,L,Yoshio Mckenzie,molestie orci tincidunt adipiscing. Mauris molestie pharetra nibh. Aliquam ornare,
2012-02-04T04:19:59-08:00,Ellen,ADD,L,Noel Huff,Aliquam fringilla cursus purus. Nullam scelerisque neque sed sem egestas
2012-12-13T22:02:36-08:00,John,REMOVE,F,Calista Duncan,scelerisque sed, sapien. Nunc pulvinar arcu et pede. Nunc sed
2012-01-05T07:21:08-08:00,John,REMOVE,F,Hop Nolan,non, lacinia at, iaculis quis, pede. Praesent eu dui. Cum
2012-07-03T17:04:33-07:00,John,ADD,F,McKenzie Fischer,pretium et, rutrum non, hendrerit id, ante. Nunc mauris sapien,
2012-09-16T09:25:59-07:00,John,ADD,F,Paloma Larson,arcu. Curabitur ut odio vel est tempor bibendum. Donec felis
2012-03-14T16:07:41-07:00,John,REMOVE,F,Ruby Dillard,est. Mauris eu turpis. Nulla aliquet. Proin velit. Sed malesuada
2012-08-14T07:53:23-07:00,John,REMOVE,G,Nayda Thompson,Duis mi enim, condimentum eget, volutpat ornare, facilisis eget, ipsum.
2012-11-21T11:43:19-08:00,John,ADD,G,Lillian Gould,et malesuada fames ac turpis egestas. Fusce aliquet magna a
2012-12-07T05:24:29-08:00,John,ADD,G,Lynn Norman,massa lobortis ultrices. Vivamus rhoncus. Donec est. Nunc ullamcorper, velit
2013-04-12T00:12:47-07:00,John,REMOVE,G,Carissa Murphy,ornare lectus justo eu arcu. Morbi sit amet massa. Quisque
2012-11-05T18:36:09-08:00,John,REMOVE,G,Ishmael Gross,auctor, nunc nulla vulputate dui, nec tempus mauris erat egettimestamp,originator,action,network,target,context
2012-06-09T05:40:28-07:00,Michael,ADD,I,Jaden Padilla,molestie sodales. Mauris blandit enim consequat purus. Maecenas libero est,
2012-05-23T11:56:53-07:00,Michael,ADD,I,Lacota Case,elit, a feugiat tellus lorem eu metus. In lorem. Donec
2012-03-13T11:04:36-07:00,Michael,REMOVE,I,Ariel Richard,ligula eu enim. Etiam imperdiet dictum magna. Ut tincidunt orci
2013-01-16T23:28:22-08:00,Michael,REMOVE,I,Alvin Franco,risus a ultricies adipiscing, enim mi tempor lorem, eget mollis
2012-08-27T07:37:47-07:00,Michael,ADD,I,Lesley Larsen,lacus, varius et, euismod et, commodo at, libero. Morbi accumsan
2012-05-27T22:46:21-07:00,Michael,ADD,T,Clinton Schmidt,porta elit, a feugiat tellus lorem eu metus. In lorem.
2012-11-12T19:59:23-08:00,Michael,REMOVE,T,Melyssa Salinas,consequat enim diam vel arcu. Curabitur ut odio vel est
2013-03-12T01:44:30-07:00,Michael,REMOVE,T,Rashad Howard,diam dictum sapien. Aenean massa. Integer vitae nibh. Donec est
2012-05-10T19:21:23-07:00,Michael,ADD,T,Naomi Walls,sit amet nulla. Donec non justo. Proin non massa non
2012-05-17T18:10:47-07:00,Michael,ADD,T,Lee Burch,ante. Maecenas mi felis, adipiscing fringilla, porttitor vulputate, posuere vulputate,
2012-06-04T21:10:09-07:00,Ted,REMOVE,L,Rhiannon Mathis,consectetuer mauris id sapien. Cras dolor dolor, tempus non, lacinia
2013-04-06T11:50:23-07:00,Ted,REMOVE,L,Wynter Campbell,adipiscing elit. Etiam laoreet, libero et tristique pellentesque, tellus sem
2013-01-25T13:14:04-08:00,Ted,ADD,L,Reuben Cooper,nec mauris blandit mattis. Cras eget nisi dictum augue malesuada
2012-04-28T02:55:34-07:00,Ted,ADD,L,Hayfa Dillon,neque sed sem egestas blandit. Nam nulla magna, malesuada vel,
2012-12-30T20:32:10-08:00,Ted,REMOVE,L,Drake Shaffer,egestas ligula. Nullam feugiat placerat velit. Quisque varius. Nam porttitor
2013-02-07T12:28:40-08:00,Ted,REMOVE,F,Castor Barrera,pede, nonummy ut, molestie in, tempus eu, ligula. Aenean euismod
2012-02-17T23:59:09-08:00,Ted,ADD,F,Abraham Patel,lacus. Quisque purus sapien, gravida non, sollicitudin a, malesuada id,
2012-09-30T19:33:00-07:00,Ted,ADD,F,Isabelle Kelley,convallis, ante lectus convallis est, vitae sodales nisi magna sed
2012-09-10T19:55:37-07:00,Ted,REMOVE,F,Lars Cline,ut lacus. Nulla tincidunt, neque vitae semper egestas, urna justo
2012-07-09T02:05:33-07:00,Ted,REMOVE,F,Charity Richard,at, nisi. Cum sociis natoque penatibus et magnis dis parturient
2012-09-06T22:29:33-07:00,Ellen,ADD,G,Brent Marshall,eget metus. In nec orci. Donec nibh. Quisque nonummy ipsum
2012-09-29T11:19:13-07:00,Ellen,ADD,G,Portia Lee,Vestibulum ante ipsum primis in faucibus orci luctus et ultrices
2012-01-24T01:13:39-08:00,Ellen,REMOVE,G,Kieran Gardner,Nunc laoreet lectus quis massa. Mauris vestibulum, neque sed dictum
2013-01-22T17:47:11-08:00,Ellen,REMOVE,G,Beverly Pennington,ornare placerat, orci lacus vestibulum lorem, sit amet ultricies sem
2013-03-27T11:35:32-07:00,Ellen,ADD,G,Xander Wyatt,ac tellus. Suspendisse sed dolor. Fusce mi lorem, vehicula et,
2012-08-16T23:52:21-07:00,Ellen,ADD,I,Georgia Chaney,Sed nulla ante, iaculis nec, eleifend non, dapibus rutrum, justo.
2012-10-30T06:22:18-07:00,Ellen,REMOVE,I,Kirsten Chen,lorem, luctus ut, pellentesque eget, dictum placerat, augue. Sed molestie.
2012-06-13T04:14:25-07:00,Ellen,REMOVE,I,Lamar Medina,pede blandit congue. In scelerisque scelerisque dui. Suspendisse ac metus
2012-09-07T23:33:53-07:00,Ellen,ADD,I,Alisa Collier,ac sem ut dolor dapibus gravida. Aliquam tincidunt, nunc ac
2013-02-07T13:58:36-08:00,Ellen,ADD,I,Ingrid Hahn,magna a tortor. Nunc commodo auctor velit. Aliquam nisl. Nulla
2012-09-19T22:26:19-07:00,John,REMOVE,T,Whilemina Key,dictum placerat, augue. Sed molestie. Sed id risus quis diam
2013-03-18T16:59:26-07:00,John,REMOVE,T,Amanda Duncan,dictum eu, placerat eget, venenatis a, magna. Lorem ipsum dolor
2012-11-14T16:01:14-08:00,John,ADD,T,Dillon Russo,cursus non, egestas a, dui. Cras pellentesque. Sed dictum. Proin
2012-07-22T02:06:09-07:00,John,ADD,T,Nayda Trujillo,ut ipsum ac mi eleifend egestas. Sed pharetra, felis eget
2012-12-16T11:07:11-08:00,John,REMOVE,T,Gray Stephenson,purus mauris a nunc. In at pede. Cras vulputate velit
2012-02-11T23:03:19-08:00,John,REMOVE,L,Sonia Daugherty,vitae, aliquet nec, imperdiet nec, leo. Morbi neque tellus, imperdiet
2012-12-14T09:07:22-08:00,John,ADD,L,Holly Robbins,luctus, ipsum leo elementum sem, vitae aliquam eros turpis non
2012-12-31T00:07:48-08:00,John,ADD,L,McKenzie Goff,sagittis. Nullam vitae diam. Proin dolor. Nulla semper tellus id
2012-02-27T06:26:56-08:00,John,REMOVE,L,Henry Hampton,nibh dolor, nonummy ac, feugiat non, lobortis quis, pede. Suspendisse
2012-08-21T20:27:18-07:00,John,REMOVE,L,Fitzgerald Santana,sed pede. Cum sociis natoque penatibus et magnis dis parturient
2012-02-24T13:40:04-08:00,Steve,ADD,F,Adena Richmond,sem. Pellentesque ut ipsum ac mi eleifend egestas. Sed pharetra,
2012-02-18T12:39:09-08:00,Steve,ADD,F,Destiny Salinas,Integer tincidunt aliquam arcu. Aliquam ultrices iaculis odio. Nam interdum
2013-04-07T10:56:10-07:00,Steve,REMOVE,F,Amelia Blanchard,nulla. Integer vulputate, risus a ultricies adipiscing, enim mi tempor
2012-09-18T15:25:13-07:00,Steve,REMOVE,F,Camden Rios,Etiam laoreet, libero et tristique pellentesque, tellus sem mollis dui,
2012-11-12T23:11:55-08:00,Steve,ADD,F,Yasir Cameron,ante blandit viverra. Donec tempus, lorem fringilla ornare placerat, orci
2012-06-24T09:33:23-07:00,Steve,ADD,G,Reed Acosta,ultricies adipiscing, enim mi tempor lorem, eget mollis lectus pede
2012-09-25T06:21:49-07:00,Steve,REMOVE,G,Quon Henry,nec ante blandit viverra. Donec tempus, lorem fringilla ornare placerat,
2012-07-10T01:59:11-07:00,Steve,REMOVE,G,Unity Bernard,et arcu imperdiet ullamcorper. Duis at lacus. Quisque purus sapien,
2013-04-06T01:24:06-07:00,Steve,ADD,G,Montana Irwin,neque. Nullam nisl. Maecenas malesuada fringilla est. Mauris eu turpis.
2012-12-19T05:00:46-08:00,Steve,ADD,G,Malachi Rojas,pede, nonummy ut, molestie in, tempus eu, ligula. Aenean euismod
2013-04-01T01:22:51-07:00,Karen,REMOVE,I,Willow Rowe,gravida mauris ut mi. Duis risus odio, auctor vitae, aliquet
2012-01-02T22:23:53-08:00,Karen,REMOVE,I,Rama Bennett,a, magna. Lorem ipsum dolor sit amet, consectetuer adipiscing elit.
2012-01-01T21:18:43-08:00,Karen,ADD,I,Sigourney Brown,scelerisque neque sed sem egestas blandit. Nam nulla magna, malesuada
2012-08-13T15:01:25-07:00,Karen,ADD,I,Pascale Dunn,libero. Donec consectetuer mauris id sapien. Cras dolor dolor, tempus
2012-12-25T00:55:34-08:00,Karen,REMOVE,I,Kelly Deleon,metus facilisis lorem tristique aliquet. Phasellus fermentum convallis ligula. Donec
2012-08-03T01:42:24-07:00,Karen,REMOVE,T,Christine Ayala,tristique aliquet. Phasellus fermentum convallis ligula. Donec luctus aliquet odio.
2012-03-26T11:49:13-07:00,Karen,ADD,T,Ayanna Roth,eu, eleifend nec, malesuada ut, sem. Nulla interdum. Curabitur dictum.
2012-05-16T09:02:22-07:00,Karen,ADD,T,Penelope Perkins,luctus ut, pellentesque eget, dictum placerat, augue. Sed molestie. Sed
2012-10-22T05:12:53-07:00,Karen,REMOVE,T,Portia Hayes,Nunc quis arcu vel quam dignissim pharetra. Nam ac nulla.
2012-03-03T06:50:05-08:00,Karen,REMOVE,T,Callum Ball,mi lorem, vehicula et, rutrum eu, ultrices sit amet, risus.
2013-02-11T15:27:47-08:00,Michael,ADD,L,Ginger Wooten,massa. Quisque porttitor eros nec tellus. Nunc lectus pede, ultrices
2013-02-04T21:27:05-08:00,Michael,ADD,L,Francis Riddle,diam. Sed diam lorem, auctor quis, tristique ac, eleifend vitae,
2012-12-22T14:16:33-08:00,Michael,REMOVE,L,Brady Mills,aliquam, enim nec tempus scelerisque, lorem ipsum sodales purus, in
2013-03-25T12:59:52-07:00,Michael,REMOVE,L,Yasir Gutierrez,ipsum primis in faucibus orci luctus et ultrices posuere cubilia
2012-04-05T07:05:20-07:00,Michael,ADD,L,Lucius Travis,Integer sem elit, pharetra ut, pharetra sed, hendrerit a, arcu.
2012-07-27T19:13:53-07:00,Michael,ADD,F,Hannah Britt,feugiat. Lorem ipsum dolor sit amet, consectetuer adipiscing elit. Aliquam
2012-08-09T11:40:41-07:00,Michael,REMOVE,F,Cameron Coleman,amet, consectetuer adipiscing elit. Etiam laoreet, libero et tristique pellentesque,
2012-12-20T07:36:23-08:00,Michael,REMOVE,F,Gail Waller,et, rutrum eu, ultrices sit amet, risus. Donec nibh enim,
2012-02-03T22:49:23-08:00,Michael,ADD,F,Leilani Owens,luctus vulputate, nisi sem semper erat, in consectetuer ipsum nunc
2012-10-19T11:28:59-07:00,Michael,ADD,F,Erica Silva,fringilla, porttitor vulputate, posuere vulputate, lacus. Cras interdum. Nunc sollicitudin
2013-02-18T22:57:15-08:00,Ted,REMOVE,G,Roanna Cooley,mattis ornare, lectus ante dictum mi, ac mattis velit justo
2013-03-08T19:26:24-08:00,Ted,REMOVE,G,Boris Leonard,Vivamus rhoncus. Donec est. Nunc ullamcorper, velit in aliquet lobortis,
2013-01-11T15:14:28-08:00,Ted,ADD,G,Jermaine Morin,penatibus et magnis dis parturient montes, nascetur ridiculus mus. Proin
2012-05-26T19:20:00-07:00,Ted,ADD,G,Warren Mercer,rhoncus. Donec est. Nunc ullamcorper, velit in aliquet lobortis, nisi
2012-11-20T15:33:58-08:00,Ted,REMOVE,G,Mohammad Dean,magna tellus faucibus leo, in lobortis tellus justo sit amet
2012-02-01T01:04:11-08:00,Ted,REMOVE,I,Mark Mcneil,orci, consectetuer euismod est arcu ac orci. Ut semper pretium
2013-03-13T07:08:58-07:00,Ted,ADD,I,Malik Rice,libero lacus, varius et, euismod et, commodo at, libero. Morbi
2013-01-24T04:30:46-08:00,Ted,ADD,I,Ignatius Bridges,mauris ipsum porta elit, a feugiat tellus lorem eu metus.
2012-12-26T04:57:27-08:00,Ted,REMOVE,I,Vance Oneal,Proin vel nisl. Quisque fringilla euismod enim. Etiam gravida molestie
2012-07-15T08:25:50-07:00,Ted,REMOVE,I,Scarlet Workman,erat. Vivamus nisi. Mauris nulla. Integer urna. Vivamus molestie dapibus
2012-08-17T19:20:49-07:00,Ellen,ADD,T,Rae Rowland,eros non enim commodo hendrerit. Donec porttitor tellus non magna.
2012-05-05T18:56:55-07:00,Ellen,ADD,T,Nicole Tyson,Nunc ut erat. Sed nunc est, mollis non, cursus non,
2013-02-03T13:38:23-08:00,Ellen,REMOVE,T,Hilel Harmon,ac metus vitae velit egestas lacinia. Sed congue, elit sed
2013-04-13T02:01:01-07:00,Ellen,REMOVE,T,Orla Gilbert,diam. Sed diam lorem, auctor quis, tristique ac, eleifend vitae,
2012-09-05T17:24:19-07:00,Ellen,ADD,T,India Andrews,Etiam imperdiet dictum magna. Ut tincidunt orci quis lectus. Nullam
2012-02-09T08:30:51-08:00,Ellen,ADD,L,Allen Nash,In mi pede, nonummy ut, molestie in, tempus eu, ligula.
2012-07-29T07:46:18-07:00,Ellen,REMOVE,L,Patience Fleming,sed, hendrerit a, arcu. Sed et libero. Proin mi. Aliquam
2012-03-02T06:15:27-08:00,Ellen,REMOVE,L,Margaret Peck,ac turpis egestas. Fusce aliquet magna a neque. Nullam ut
2013-03-27T08:09:52-07:00,Ellen,ADD,L,Jayme Morgan,vulputate dui, nec tempus mauris erat eget ipsum. Suspendisse sagittis.
2012-01-24T14:26:41-08:00,Ellen,ADD,L,Zia Johnson,Suspendisse ac metus vitae velit egestas lacinia. Sed congue, elit
2012-03-09T11:30:33-08:00,John,REMOVE,F,Guinevere Dudley,nec, eleifend non, dapibus rutrum, justo. Praesent luctus. Curabitur egestas
2013-01-21T08:00:20-08:00,John,REMOVE,F,Virginia Wells,interdum. Sed auctor odio a purus. Duis elementum, dui quis
2012-03-26T10:19:40-07:00,John,ADD,F,Amber Greer,augue, eu tempor erat neque non quam. Pellentesque habitant morbi
2012-11-10T23:34:47-08:00,John,ADD,F,Reagan Brady,eu, eleifend nec, malesuada ut, sem. Nulla interdum. Curabitur dictum.
2013-04-15T02:09:19-07:00,John,REMOVE,F,Cameron Leach,auctor. Mauris vel turpis. Aliquam adipiscing lobortis risus. In mi
2012-02-17T23:25:37-08:00,John,REMOVE,G,Penelope Marquez,Aliquam fringilla cursus purus. Nullam scelerisque neque sed sem egestas
2013-03-18T06:12:35-07:00,John,ADD,G,Whitney Francis,sem, vitae aliquam eros turpis non enim. Mauris quis turpis
2012-12-23T15:47:10-08:00,John,ADD,G,Upton Ware,Nam nulla magna, malesuada vel, convallis in, cursus et, eros.
2012-02-29T19:50:45-08:00,John,REMOVE,G,Zelenia Hernandez,rutrum eu, ultrices sit amet, risus. Donec nibh enim, gravida
2012-04-21T23:38:09-07:00,John,REMOVE,G,Patrick Hensley,non, vestibulum nec, euismod in, dolor. Fusce feugiat. Lorem ipsumtimestamp,originator,action,network,target,context
2013-02-02T04:26:07-08:00,Michael,ADD,I,Jonah Roberts,eu dolor egestas rhoncus. Proin nisl sem, consequat nec, mollis
2013-01-14T13:13:00-08:00,Michael,ADD,I,Allistair Peters,lorem semper auctor. Mauris vel turpis. Aliquam adipiscing lobortis risus.
2012-02-16T06:04:52-08:00,Michael,REMOVE,I,Jordan Rhodes,malesuada malesuada. Integer id magna et ipsum cursus vestibulum. Mauris
2013-01-25T04:56:24-08:00,Michael,REMOVE,I,Galena Lyons,Suspendisse tristique neque venenatis lacus. Etiam bibendum fermentum metus. Aenean
2013-01-17T15:47:04-08:00,Michael,ADD,I,Katell Parsons,dictum eu, eleifend nec, malesuada ut, sem. Nulla interdum. Curabitur
2012-12-26T16:47:32-08:00,Michael,ADD,T,Octavius Huff,dui. Suspendisse ac metus vitae velit egestas lacinia. Sed congue,
2012-08-20T10:36:44-07:00,Michael,REMOVE,T,Laurel Hendrix,scelerisque mollis. Phasellus libero mauris, aliquam eu, accumsan sed, facilisis
2012-10-15T19:24:07-07:00,Michael,REMOVE,T,Ora Garza,consectetuer adipiscing elit. Aliquam auctor, velit eget laoreet posuere, enim
2012-11-22T13:55:52-08:00,Michael,ADD,T,Levi Gaines,lectus, a sollicitudin orci sem eget massa. Suspendisse eleifend. Cras
2012-01-18T05:28:32-08:00,Michael,ADD,T,Bethany Berger,pede. Cras vulputate velit eu sem. Pellentesque ut ipsum ac
2012-12-03T04:54:49-08:00,Ted,REMOVE,L,Barclay Maldonado,quis lectus. Nullam suscipit, est ac facilisis facilisis, magna tellus
2012-12-20T00:58:13-08:00,Ted,REMOVE,L,Frances Mcfarland,eget, ipsum. Donec sollicitudin adipiscing ligula. Aenean gravida nunc sed
2012-07-01T07:51:44-07:00,Ted,ADD,L,Keane Bowen,Aliquam ultrices iaculis odio. Nam interdum enim non nisi. Aenean
